{
  "$defs": {
    "actor": {
      "additionalProperties": false,
      "properties": {
        "actorId": {
          "minLength": 1,
          "type": "string"
        },
        "actorType": {
          "enum": [
            "human",
            "agent",
            "kernel"
          ]
        }
      },
      "required": [
        "actorType",
        "actorId"
      ],
      "type": "object"
    },
    "exclusionRef": {
      "additionalProperties": false,
      "properties": {
        "$exclusion": {
          "$ref": "#/$defs/id"
        }
      },
      "required": [
        "$exclusion"
      ],
      "type": "object"
    },
    "gapRef": {
      "additionalProperties": false,
      "properties": {
        "$gap": {
          "$ref": "#/$defs/id"
        }
      },
      "required": [
        "$gap"
      ],
      "type": "object"
    },
    "id": {
      "pattern": "^[a-z0-9][a-z0-9._:-]*$",
      "type": "string"
    },
    "provenance": {
      "additionalProperties": false,
      "properties": {
        "extractedAt": {
          "type": "string"
        },
        "extractor": {
          "type": "string"
        },
        "locator": {
          "type": "string"
        },
        "sourceArtifact": {
          "type": "string"
        }
      },
      "required": [
        "sourceArtifact",
        "locator",
        "extractor",
        "extractedAt"
      ],
      "type": "object"
    },
    "timestamp": {
      "pattern": "^\\d{4}-\\d{2}-\\d{2}(T\\d{2}:\\d{2}:\\d{2}(\\.\\d+)?Z)?$",
      "type": "string"
    }
  },
  "$id": "https://docket.offgriddevices.com/schema/EpisodeDiff.schema.json",
  "$schema": "https://json-schema.org/draft/2020-12/schema",
  "additionalProperties": false,
  "description": "",
  "properties": {
    "added": {
      "items": {
        "type": "string"
      },
      "type": "array"
    },
    "because": {
      "$ref": "#/$defs/id"
    },
    "changed": {
      "items": {
        "additionalProperties": false,
        "properties": {
          "after": {
            "type": "string"
          },
          "before": {
            "type": "string"
          },
          "field": {
            "type": "string"
          },
          "object": {
            "type": "string"
          }
        },
        "required": [
          "object",
          "field",
          "before",
          "after"
        ],
        "type": "object"
      },
      "type": "array"
    },
    "confidence": {
      "enum": [
        "explicit",
        "inferred",
        "absent"
      ]
    },
    "createdAt": {
      "$ref": "#/$defs/timestamp"
    },
    "createdBy": {
      "$ref": "#/$defs/actor"
    },
    "from": {
      "$ref": "#/$defs/id"
    },
    "id": {
      "$ref": "#/$defs/id"
    },
    "ingestionProvenance": {
      "$ref": "#/$defs/provenance"
    },
    "judgmentsChanged": {
      "items": {
        "additionalProperties": true,
        "type": "object"
      },
      "type": "array"
    },
    "judgmentsConsistent": {
      "items": {
        "type": "string"
      },
      "type": "array"
    },
    "kernelVersion": {
      "type": "string"
    },
    "pairing": {
      "type": "string"
    },
    "rankingAfter": {
      "items": {
        "type": "string"
      },
      "type": "array"
    },
    "rankingBefore": {
      "items": {
        "type": "string"
      },
      "type": "array"
    },
    "ratingsChanged": {
      "items": {
        "additionalProperties": true,
        "type": "object"
      },
      "type": "array"
    },
    "removed": {
      "items": {
        "type": "string"
      },
      "type": "array"
    },
    "rev": {
      "minimum": 1,
      "type": "integer"
    },
    "supersedes": {
      "$ref": "#/$defs/id"
    },
    "to": {
      "$ref": "#/$defs/id"
    },
    "type": {
      "const": "EpisodeDiff"
    }
  },
  "required": [
    "id",
    "type",
    "rev",
    "createdBy",
    "createdAt",
    "from",
    "to",
    "because",
    "changed",
    "added",
    "removed",
    "judgmentsChanged",
    "judgmentsConsistent",
    "ratingsChanged",
    "rankingBefore",
    "rankingAfter",
    "pairing",
    "kernelVersion"
  ],
  "title": "EpisodeDiff",
  "type": "object"
}
